id;active;name;categories;price;tax_rules_ID;wholesale_price;on_sale;discount_amount;discount_percent;discount_from;discount_to;reference;supplier_reference;supplier;manufacturer;EAN13;UPC;ecotax;width;height;depth;weight;quantity;minimal_quantity;visibility;additional_shipping_cost;unity;unit_price;short_description;description;tags;meta_title;meta_keywords;meta_description;url_rewrite;text_when_in_stock;text_when_backorder_allowed;available_for_order;product_available_date;product_creation_date;show_price;image_urls;delete_existing_images;feature;available_online_only;condition_;customizable;uploadable;text_fields;out_of_stock;shop_id;advanced_stock_management;depends_on_stock;warehouse
1990;1;"FF396 CR1 DIABLO CARBON HI-VIS";7,40;255.371901;1;;1;59.00;19.093851;;;;;;15;;;;;;;;0;1;;;;;;"<p><strong>FF396 CR1 DIABLO CARBON HI-VIS YELLOW</strong></p>
<p>Casco integral de carbono de prestaciones muy elevadas, peso reducido de 1.350gr y est&eacute;tica impactante utilizado por los pilotos en las competiciones m&aacute;s exigentes.&nbsp;El dise&ntilde;o de la calota externa del FF396 integra varios principios aerodin&aacute;micos esenciales que utilizan esta energ&iacute;a para mejorar la estabilidad del casco y su sistema interno de ventilaci&oacute;n, disminuyendo notablemente el ruido en la conducci&oacute;n. La calota externa se ha dise&ntilde;ado en 2 tama&ntilde;os y para su fabricaci&oacute;n se ha utilizado compuesto de fibras de excelente resistencia a los impactos y tratamiento anti-UVA para&nbsp;resistir la incidencia de los rayos UVA. Cuenta con diversos sistema de ventilaci&oacute;n, 3 en la zona frontal y extractores traseros que optimizan el paso del aire, manteniendo una excelente ventilaci&oacute;n interior. El interior del casco es completamente anat&oacute;mico y totalmente extra&iacute;ble y est&aacute; fabricado con innovadores tejidos suaves transpirables, antibacterianos y de secado r&aacute;pido del sudor que garantizan en todo momento el mejor ajuste a la cabeza y el mayor confort. Las almohadillas laterales estan cortadas a l&aacute;ser e incorporan sistema&nbsp;Air Flate System, una tecnolog&iacute;a que hace que el casco se adapte perfectamente a la anatom&iacute;a o necesidades del motorista. Compuesto de una bomba ligada a dos almohadillas de aire, integrada en las mejillas laterales, el&nbsp;Air Flate permite ajustar el confort interno del casco en funci&oacute;n de las necesidades, m&aacute;s o menos apretado seg&uacute;n si circulamos en ciudad o autopista con una sencilla presi&oacute;n del pulgar sobre la bomba, las almohadillas son completamente extra&iacute;bles, lavables y anti-bacterianas. Pantalla exterior fabricada en Lexan inyectado anti-ara&ntilde;azos y antie-vaho con pinlock incluido, doble pantalla antiniebla y l&aacute;mina anti-suciedad.&nbsp;Protector de&nbsp;nariz y&nbsp;cortinilla de mentonera integrados de serie. Cierre de doble anilla interior y sistema de fijaci&oacute;n Tearoff con mecanismo de r&aacute;pida extracci&oacute;n. Tallas desde la XS a la XXL. Preparado para Bluetooth. Certificado ECE 22.05/DOT.</p>";ciudad,carretera,;"FF396 CR1 DIABLO CARBON HI-VIS";;;casco-integral-ls2-ff396-cr1-diablo-carbon-hi-vis;"En stock";"Bajo pedido";1;2014-07-17;2014-07-17;1;http://bubumotos.com/data/producto/grande/1412866840_carbono.jpg;1;;0;;0;0;0;0;1;0;0;0
2002;1;"SOBREDEPOSITO XS307 15LTS";4,23;95.041322;1;;1;20.00;17.391304;;;;;;64;;;;;;;;1;1;;;;;;"<p><strong>BOLSA SOBREDEP&Oacute;SITO TANKLOCK EASYLOCK XS307&nbsp;15LTS L/XSTREAM PBF</strong></p>
<p>CAPACIDAD de 15lts. y DIMENSIONES (axpxh)&nbsp;180&gt;210 x 350 x 270 mm. COLOR en Negro. Con el nuevo sistema TankLock para bolsas sobredep&oacute;sito se eliminan las correas e imanes que se hab&iacute;an utilizado hasta ahora para su fijaci&oacute;n en la moto; Gracias a un peque&ntilde;o aro met&aacute;lico que se fija sobre la tapa del dep&oacute;sito y a la base con enganche particular de &eacute;stas bolsas, la fijaci&oacute;n a la moto se realiza con una ligera presi&oacute;n; Para su desenganche basta con tirar de una palanca roja situada en la base.&nbsp;Adem&aacute;s de ser un sencillo m&eacute;todo de adaptaci&oacute;n a la moto, esta novedosa t&eacute;cnica permite a los motociclistas desenganchar el art&iacute;culo en un instante con el simple accionamiento de una palanca roja que se sit&uacute;a en la base. Fabricada en 1200D nylon y cremallera termo sellada. Tiradores engomados y asa de transporte. Bolsa impermeable para la lluvia con sistema de anclaje Easylock con arandela de fijaci&oacute;n espec&iacute;fica. Los adaptadores met&aacute;licos para montar sobre el dep&oacute;sito var&iacute;an seg&uacute;n el tipo de tap&oacute;n siendo necesario verificar si existe un kit adaptador espec&iacute;fico para cada marca, modelo y a&ntilde;o de moto. Verifica el Kit adaptador met&aacute;lico compatible con su modelo de moto, en la lista de compatibilidad.</p>";carretera,;"SOBREDEPOSITO XS307 15LTS";;;mochila-givi-sobredeposito-xs307-15lts;"En stock";"Bajo pedido";1;2014-07-25;2014-07-25;1;http://bubumotos.com/data/producto/grande/1406279887_sobredeposito_xs307.jpg;1;;0;;0;0;0;0;1;0;0;0
2005;1;"PANTALLA AHUM CX1PN";42;33.057851;1;;0;NULL;NULL;;;;;;40;;;;;;;;1;1;;;;;;NULL;ciudad,;"PANTALLA AHUM CX1PN";;;accesorio-shoei-pantalla-ahum-cx1pn;"En stock";"Bajo pedido";1;2014-07-29;2014-07-29;1;NULL;1;;0;;0;0;0;0;1;0;0;0
2007;1;"CHAQUETA MEGATON DRYSTAR ";8,55;223.099174;1;;1;70.00;25.930728;;;;;;11;;;;;;;;4;1;;;;;;"<p><strong>Chaqueta Apinestars Megaton Drystar</strong></p>
<p>Chaqueta de estilo deportivo dise&ntilde;ada tanto para cubrir largas distancias como para la conducci&oacute;n urbana en general. Incorpora protecciones en codos y hombros as&iacute; como refuerzos en zonas estrat&eacute;gicas, proporcionando una gran resistencia a los impactos y a la abrasi&oacute;n. Gracias al exclusivo tejido Drystar&reg; de Alpinestars (100% impermeable y transpirable) esta chaqueta se comporta de forma soberbia en todo tipo de condiciones clim&aacute;ticas.Confeccionada en polyester 600D con revestimiento PU para una durabilidad y resistencia adicionales.Incorpora el exclusivo tejido Drystar&reg; de Alpinestars (100% impermeable y transpirable), ofreciendo un excelente rendimiento en cualquier condici&oacute;n clim&aacute;tica.Forro t&eacute;rmico de manga larga desmontable que asegura el m&aacute;ximo confort en d&iacute;as c&aacute;lidos o fr&iacute;os.Paneles el&aacute;sticos en acorde&oacute;n en codos y hombros para una mejor movilidad.Entradas de aire en los hombros con cremalleras y salidas de aire traseras con cremalleras que ofrecen una mayor regulaci&oacute;n de los flujos de aire internos para aumentar la comodidad mientras pilotamos.Caracter&iacute;sticas de seguridad. Protecciones desmontables Bio Armor en hombros y codos (con certificaci&oacute;n CE).Compartimentos con c&oacute;modo acolchado de espuma para el&nbsp;protector pectoral Alpinestars Bionic Chest&nbsp;y para el&nbsp;protector de espalda Alpinestars Bio-Armor&nbsp;(no incluidos). Refuerzos de pol&iacute;mero impreso texturizado en la zona de hombros y codos para proporcionar una mayor resistencia a la abrasi&oacute;n.Dos tiras ajustables con velcro en cada manga para prevenir el desplazamiento de las protecciones.Personalizaci&oacute;n y comodidad. Mangas pre-curvadas para una mayor comodidad y rendimiento en la posici&oacute;n de conducci&oacute;n.Cremalleras en los pu&ntilde;os para regular el volumen de las mangas.Sistema de cierre del cuello con doble velcro para un ajuste prefecto.Acabados de cuello y pu&ntilde;os en Neopreno&reg; para mayor confort.Perfil trasero m&aacute;s largo y cintur&oacute;n ajustable.Bolsillos internos impermeables.Cremallera de conexi&oacute;n chaqueta-pantal&oacute;n.</p>";ciudad,carretera,;"CHAQUETA MEGATON DRYSTAR ";;;chaqueta-invierno-alpinestars-chaqueta-megaton-drystar;"En stock";"Bajo pedido";1;2014-07-29;2014-07-29;1;http://bubumotos.com/data/producto/grande/1406649360_megaton.jpg;1;;0;;0;0;0;0;1;0;0;0
2010;1;"CHAQUETA HELD 4 TOURING ";8;211.528926;1;;1;25.59;9.998046;;;;;;110;;;;;;;;0;1;;;;;;"<p><strong>CHAQUETA HELD 4-Touring</strong></p>
<p>Confeccionada en Airguard 500D (100% poliamida). Dispone de forro interior de malla, forro t&eacute;rmico desmontable y membrana fija Reissa-Z&reg; (impermeable, transpirable y a prueba de viento). Incorpora protectores Knox en hombros y codos (homologados EN 1621-1) y protector en la espalda (homologado EN 1621-2). Acolchado especial con espuma en la espalda. Paneles el&aacute;sticos de Schoeller&reg; Kevlar&reg; debajo de los brazos para mayor confort. Suave tejido en el cuello. Cintura, pu&ntilde;os, ancho de los brazos y parte baja de la chaqueta regulables. Entradas de aire con cremallera en la zona delantera y trasera. Cremallera de conexi&oacute;n chaqueta-pantal&oacute;n. Varios bolsillos exteriores e interiores. Elementos reflectantes para una mejor visibilidad en conducci&oacute;n nocturna o con poca luz.&nbsp;</p>";carretera,;"CHAQUETA HELD 4 TOURING ";;;chaqueta-dynamic-line-chaqueta-held-4-touring;"En stock";"Bajo pedido";1;2014-07-29;2014-07-29;1;http://bubumotos.com/data/producto/grande/1406655911_chaqueta-held-4-touring-6023.jpg;1;;0;;0;0;0;0;1;0;0;0
2013;1;"SMH10RD-01 COMMUNICATION SYSTEM DUAL";20;276.859504;1;;0;NULL;NULL;;;;;;126;;;;;;;;0;1;;;;;;"<p>El SMH10R es un auricular est&eacute;reo Bluetooth 3.0 con largo alcance de intercomunicaci&oacute;n Bluetooth dise&ntilde;ado espec&iacute;ficamente para motociclistas que prefieren factor de forma m&aacute;s peque&ntilde;o para maximizar su rendimiento, pero manteniendo las caracter&iacute;sticas ricas de intercomunicaci&oacute;n Bluetooth.&nbsp;Con el SMH10R, puede llamar con manos libres en su tel&eacute;fono m&oacute;vil Bluetooth, escuchar m&uacute;sica en est&eacute;reo o instrucciones de voz de navegaci&oacute;n GPS de forma inal&aacute;mbrica, y tener conversaciones de intercomunicaci&oacute;n en full duplex con otros pilotos. Gracias a la &uacute;ltima tecnolog&iacute;a Bluetooth y la avanzada tecnolog&iacute;a de procesamiento de se&ntilde;al digital heredado del SMH10, el SMH10R ofrece la mejor calidad de sonido tanto para el sonido entrante y saliente de su clase. dem&aacute;s, su construci&oacute;n super delgada y compacta contribuiyen a un mayor rendimiento para el ciclismo deportivo y hace que el SMH10R un compa&ntilde;ero perfecto de los motociclistas.</p>
<p>Bluetooth 3.0 Intercomunicaci&oacute;n v&iacute;a Bluetooth hasta 900 metros (980 yardas). De peso ligero y ultra delgado con perfil intercomunicador de conferencia de cuatro direcciones. Conferencia de llamada telef&oacute;nica con el usuario de intercomunicaci&oacute;n Universal Intercom&trade; Multipunto Bluetooth para tel&eacute;fono m&oacute;vil dual. Puede compartir m&uacute;sica recibir indicaciones por voz. Incorpora auriculares est&eacute;reo Bluetooth para dispositivos de audio Bluetooth, como reproductores de MP3 y control de la reproducci&oacute;n de m&uacute;sica Bluetooth AVRCP. Reproducci&oacute;n, pausa, pista siguiente y rastrear de nuevo. Nivel de sonido suficiente con amplificador de audio integrado. Manos libres Bluetooth para tel&eacute;fonos m&oacute;viles Bluetooth auricular Bluetooth o un kit manos libres est&eacute;reo Bluetooth GPS de navegaci&oacute;n. Marcaci&oacute;n r&aacute;pida. Tonos de fondo. Resistente para el uso en condiciones clim&aacute;ticas adversas. La calidad de sonido natura lAdvanced Noise Control &trade;. Se puede utilizar durante la carga de los viajes por carretera. Control de volumen individual para cada fuente de audio. Firmware actualizable. Garant&iacute;a de dos a&ntilde;os</p>";carretera,;"SMH10RD-01 COMMUNICATION SYSTEM DUAL";;;intercomunicador-sena-smh10rd-01-communication-system-dual;"En stock";"Bajo pedido";1;2014-07-30;2014-07-30;1;http://bubumotos.com/data/producto/grande/1406719426_smh10rd-01.jpg,http://bubumotos.com/data/producto/grande/1406719430_smh10r-and-transparent-helmet.jpg,http://bubumotos.com/data/producto/grande/1406719427_smh10r-main-unit3.jpg;1;;0;;0;0;0;0;1;0;0;0
2014;1;"SMH10D-10 SYSTEM DUAL PACK";20;259.504132;1;;0;NULL;NULL;;;;;;126;;;;;;;;0;1;;;;;;"<p>El SMH10 es un auricular est&eacute;reo Bluetooth 3.0 con largo alcance de intercomunicaci&oacute;n Bluetooth dise&ntilde;ado espec&iacute;ficamente para motos. Con el SMH10, puede llamar con manos libres en su tel&eacute;fono m&oacute;vil Bluetooth, escuchar m&uacute;sica en est&eacute;reo o instrucciones de voz de navegaci&oacute;n GPS por Bluetooth de forma inal&aacute;mbrica, y tener conversaciones de intercomunicaci&oacute;n en Full Duplex con un pasajero o de otros pilotos de moto. Gracias a la &uacute;ltima tecnolog&iacute;a Bluetooth y la tecnolog&iacute;a de procesamiento de se&ntilde;al digital avanzado, el SMH10 ofrece la mejor calidad de sonido tanto para el sonido entrante y saliente de su clase.&nbsp;Adem&aacute;s, el f&aacute;cil manejo y funcionamiento de los botones intuitivos hacen que el SMH10 un compa&ntilde;ero perfecto para los motoristas.</p>
<p>Bluetooth 3.0Intercomunicaci&oacute;n v&iacute;a Bluetooth hasta 900 metros. Intercomunicador conferencia de cuatro direcciones. Conferencia de llamada telef&oacute;nica con el usuario Universal Intercom &trade;. Podr&aacute; compartir m&uacute;sica. Multipunto Bluetooth para tel&eacute;fono m&oacute;vil dual. Indicaciones por voz y auriculares est&eacute;reo Bluetooth para dispositivos de audio Bluetooth, como reproductores de MP3. Control de la reproducci&oacute;n de m&uacute;sica Bluetooth AVRCP: reproducci&oacute;n, pausa, pista siguiente y rastrear de nuevo. De f&aacute;cil manejo mediante el vers&aacute;til Jog Dial (adquirida de Patentes) Nivel de sonido suficiente con amplificador de audio integrado. Manos libres Bluetooth para tel&eacute;fonos m&oacute;viles Bluetooth. Auricular Bluetooth o un kit manos libres est&eacute;reo Bluetooth GPS de navegaci&oacute;n y marcaci&oacute;n r&aacute;pida. Tonos de fondo. M&uacute;sica est&eacute;reo por cable de 3,5 mm de audio. Resistente al uso en condiciones clim&aacute;ticas adversas. Calidad de sonido natural Advanced Noise Control &trade; de hasta 12 horas de tiempo de conversaci&oacute;n, 10 d&iacute;as en stand-by. Se puede utilizar durante la carga en los viajes por carretera. Control de volumen individual para cada fuente de audio Firmware actualizable. Garant&iacute;a de dos a&ntilde;os</p>";carretera,;"SMH10D-10 SYSTEM DUAL PACK";;;intercomunicador-sena-smh10d-10-system-dual-pack;"En stock";"Bajo pedido";1;2014-07-30;2014-07-30;1;http://bubumotos.com/data/producto/grande/1406736987_smh10-main-unit-7.jpg,http://bubumotos.com/data/producto/grande/1406736995_smh10r-and-transparent-helmet.jpg,http://bubumotos.com/data/producto/grande/1406736993_smh10-bk-24.jpg;1;;0;;0;0;0;0;1;0;0;0
2015;1;"FIJACION MANILLARES CUBIERTOS SSC";20,42;16.438017;1;;0;NULL;NULL;;;;;;102;;;;;;;;0;1;;;;;;"<p><strong>INTERPHONE SSC</strong></p>
<p>Sistema de montaje para el manillar cubierto no tubular. Gracias al preciso mecanismo de ajuste de guia obligada, la microregulacion del dispositivo de bloqueo de la correa,&nbsp;permite obtener&nbsp;la m&aacute;xima estabilidad en manillares no tubulares de scooters y motos. La banda de goma incluida, se debe montar en el interior de la cinta tirando de la manija para proteger micr&oacute;metro o rozaduras, y cortar con anticipaci&oacute;n cerca de la medida de la circunferencia del manillar. Gracias cierre micr&oacute;metro progresivo logra la m&aacute;xima estabilidad del sistema de fijaci&oacute;n. El sistema de control del soporte de montaje permite que el dispositivo se ajuste con precisi&oacute;n cualquier producto de la gama de bayoneta para el interfono. El sistema SSC se puede extraer f&aacute;cilmente para su uso en las motos, y tambi&eacute;n est&aacute; equipado con la palanca de liberaci&oacute;n r&aacute;pida que le permite extraer el dispositivo. El SSC es inteligente y robusto, y no requiere para su instalaci&oacute;n de personal calificado. Para los manillares no tubulares con una secci&oacute;n de hasta 50 cm (scooters). Soporte universal de sistema de liberaci&oacute;n r&aacute;pida. Cierre microm&eacute;trico. Soporte de montaje con &aacute;ngulo ajustable (360 &deg;)</p>";ciudad,carretera,;"FIJACION MANILLARES CUBIERTOS SSC";;;accesorio-interphone-cellular-line-fijacion-manillares-cubiertos-ssc;"En stock";"Bajo pedido";1;2014-07-31;2014-07-31;1;http://bubumotos.com/data/producto/grande/1406794779_sistema-de-fijacion-para-manillares-cubiertos_(2).jpg,http://bubumotos.com/data/producto/grande/1406794785_sistema-de-fijacion-para-manillares-cubiertos_(1).jpg,http://bubumotos.com/data/producto/grande/1406794782_sistema-de-fijacion-para-manillares-cubiertos.jpg;1;;0;;0;0;0;0;1;0;0;0
2016;1;"BLADE SV SOLID NE BR";7,40;80.991736;1;;1;10.00;10.204082;;;;;;24;;;;;;;;3;1;;;;;;"<p><strong>BLADE SV SOLID</strong></p>
<p>Casco de dise&ntilde;o aerodinamico con calota interna fabricada en termoplastico inyectado con alta absorcion de impacto y dos tallas de calota interna. Interiores de multiple densidad,extraible lavable y con ventilacion interna. Sistema de cierre micrometrico. Dispone de pantalla solar interna. Pantalla exterior anti rayas compuesta de policarbonato optico, con cierre optimo. Tiene un grosor de 2,2mm . Desmontable facilmente. Casco con homologacion Europea ECE/ONU 22.05</p>";ciudad,carretera,;"BLADE SV SOLID NE BR";;;casco-integral-mt-helmets-blade-sv-solid-ne-br;"En stock";"Bajo pedido";1;2014-07-31;2014-07-31;1;http://bubumotos.com/data/producto/grande/1406800906_blade_sv_ne_br.jpg;1;;0;;0;0;0;0;1;0;0;0
2017;1;"VELOCE SOLID PANT NE BR";7,36;30.578512;1;;1;7.05;19.054054;;;;;;24;;;;;;;;0;1;;;;;;"<p><strong>VELOCE SOLID CON PANTALLA NEGRO</strong></p>
<p>Casco Jet para motoristas ocasionales o para su uso en distancias cortas.&nbsp;Casco econ&oacute;mico con gran dise&ntilde;o y rendimiento.&nbsp;El modelo veloce tiene todo lo que un usuario puede necesitar como casco urbano o extra urbano.&nbsp;Caracter&iacute;sticas la calota est&aacute; fabircada en resina termopl&aacute;stica inyectada cuenta copn 2 EPS internos de m&uacute;ltiple densidad y su interior es desmontable, antial&eacute;rgico y lavable. El mecanismo de apertura del casco es sencillo y se puede accionar con una sola mano y la hebilla de cierre autom&aacute;tico es microm&eacute;trico. Homologaci&oacute;n ECE-22.05/</p>";ciudad,carretera,;"VELOCE SOLID PANT NE BR";;;casco-jet-mt-helmets-veloce-solid-pant-ne-br;"En stock";"Bajo pedido";1;2014-07-31;2014-07-31;1;http://bubumotos.com/data/producto/grande/1406823621_casco-mt-veloce-negro-metalico-jet.jpg,http://bubumotos.com/data/producto/grande/1406823624_casco-mt-veloce-negro-metalico-jet_(1).jpg;1;;0;;0;0;0;0;1;0;0;0
2018;1;"REVENGE REPLICA GP TUQ/ROS/NE";7,40;70.247934;1;;0;NULL;NULL;;;;;;24;;;;;;;;2;1;;;;;;"<p>Deportivo, es la particularidad mas importante en el uso de este integral con base curva, spoiler integrado y grandes ventilaciones componen la esencialidad de este casco; dos tallas de calota externa y su bajo peso hacen el resto. Se puede usar en moto de nieve con mascarilla, cuello y &ldquo;pantalla doble o electrica&rdquo;.</p>
<p>Dos tallas calotas de Policarbonato con un peso de 1400gr para las tallas XS-S-M y 1450 gren las tallas L-XL-XXL. Su interior es desmontable y lavable. Cierre microm&eacute;trico y pantalla de f&aacute;cil sustituci&oacute;n. Pantallas adaptables, transparente (CE) y original, antivaho, doble, electrica tambien oscuras, ahumada, negra e iridium y de alta definicion (CE) en azul, roja y amarilla y sistema pinlock que consiste en una doble pantalla interior antivaho de quita y pon y sistema NFC. El MT-Alert&nbsp;es un sistema que tomando como base la plataforma NFC NearVox, le permitir&aacute; enviar autom&aacute;ticamente un mensaje SMS de alerta en caso de accidente a m&uacute;ltiples destinatarios, indicando que ha tenido una situaci&oacute;n de alerta y su posici&oacute;n actual. Esto har&aacute; que las ayudas le lleguen con m&aacute;s celeridad y por lo tanto mejore en gran medida su seguridad en carretera. HOMOLOGACI&Oacute;N : ECE/ONU 22.05.P - DOT CERTIFIED&nbsp;</p>";ciudad,carretera,;"REVENGE REPLICA GP TUQ/ROS/NE";;;casco-integral-mt-helmets-revenge-replica-gp-tuq-ros-ne;"En stock";"Bajo pedido";1;2014-07-31;2014-07-31;1;http://bubumotos.com/data/producto/grande/1406824827_revenge_replica_gp_(turq_darkpink_black_side).jpg,http://bubumotos.com/data/producto/grande/1406824829_revenge_replica_gp_(turq_darkpink_black_front).jpg;1;;0;;0;0;0;0;1;0;0;0
2019;1;"LE MANS UK FLAG BL BR";7,36;69.421488;1;;0;NULL;NULL;;;;;;24;;;;;;;;0;1;;;;;;"<p><strong>CASCO JET LE MANS UK FLAG</strong></p>
<p>Casco de fibra de vidrio tipo jet de una sola calota extera y con homologaci&oacute;n europea ECE/ONU.22.05 y calota interna con aprobacion DOT (USA) de alta absorcion de impactos. fabricado en Poliestireno y con multiple densidad interior, pantalla anti-rayas de Policarbonato optimo y sistema de cierre autom&aacute;tico. La pantalla se desmonta facilmente. Su interior es lavable.&nbsp;</p>";ciudad,;"LE MANS UK FLAG BL BR";;;casco-jet-mt-helmets-le-mans-uk-flag-bl-br;"En stock";"Bajo pedido";1;2014-07-31;2014-07-31;1;http://bubumotos.com/data/producto/grande/1406826212_casco-mt-le-mans-uk-flag.jpg,http://bubumotos.com/data/producto/grande/1406826218_casco-mt-le-mans-uk-flag_(2).jpg,http://bubumotos.com/data/producto/grande/1406826216_casco-mt-le-mans-uk-flag_(1).jpg;1;;0;;0;0;0;0;1;0;0;0
2023;1;"RACING LADY 157";14;46.694215;1;;0;NULL;NULL;;;;;;16;;;;;;;;4;1;;;;;;"<p><strong>GUANTE T&Eacute;CNICO RACING LADY</strong></p>
<p>Guante de piel exclusivo para mujer. Fabricado en piel&nbsp;vacuna de 1&ordf; calidad incorpora protecci&oacute;n en fibra de carbono en nudillos + TPU + sistema de ventilaci&oacute;n integrado. Fuelles en dedos para mayor movilidad y protecci&oacute;n de goma en la falange de los dedos. Protecciones r&iacute;gidas en la palma, lateral de la mano y hueso escafoide y 2 cierres en la mu&ntilde;eca mediante velcro una doble costura y refuerzo en la palma. Silicona impresa en la palma para un mayor grip con los pu&ntilde;os. Logos inyectados en tinta.</p>";ciudad,carretera,;"RACING LADY 157";;;guantes-on-board-racing-lady-157;"En stock";"Bajo pedido";1;2014-08-01;2014-08-01;1;http://bubumotos.com/data/producto/grande/1406887892_racing_lady_157.jpg;1;;0;;0;0;0;0;1;0;0;0
2025;1;"KIT MANOS LIBRES EASY A6389";42;96.404959;1;;0;NULL;NULL;;;;;;70;;;;;;;;0;1;;;;;;"<p>Intercomunicador CABERG&nbsp;JUST SPEAK S con auricular e intercomunicador Bluetooth 3.0 inal&aacute;mbrico de f&aacute;cil instalaci&oacute;n y con dise&ntilde;o compacto. Conexi&oacute;n multipunto: 2 tel&eacute;fonos o tel&eacute;fono + GPS. Llamadas con manos libres. Control de m&uacute;sica est&eacute;reo y pistas a trav&eacute;s de Bluetooth. Perfiles de volumen individuales</p>";ciudad,;"KIT MANOS LIBRES EASY A6389";;;accesorio-caberg-kit-manos-libres-easy-a6389;"En stock";"Bajo pedido";1;2014-09-02;2014-09-02;1;http://bubumotos.com/data/producto/grande/1409656007_kit_manos_libres.jpg;1;;0;;0;0;0;0;1;0;0;0
2026;1;"HARRISON WP";8,55;144.628099;1;;1;30.00;17.142857;;;;;;34;;;;;;;;7;1;;;;;;"<p><strong>CHAQUETA HARRISON WP</strong></p>
<p>Chaqueta de poliester, anti-bacterianas, anti-sudor, forro de poli&eacute;ster perforada.&nbsp;anti-bacterial y cuello interior suave anti-sudor.&nbsp;membrana WATERTECH.&nbsp;acolchado extra&iacute;ble.&nbsp;Ventilaci&oacute;n en la parte delantera y trasera.&nbsp;sistema de cierre de cuello ajustable.&nbsp;grandes bolsillos internos y externos.&nbsp;Inserciones reflectantes de alta intensidad. Cintura y ajustes inferiores.&nbsp;Sistema de cierre para combinar la chaqueta/pantal&oacute;n</p>";ciudad,carretera,;"HARRISON WP";;;chaqueta-invierno-axo-harrison-wp;"En stock";"Bajo pedido";1;2014-09-03;2014-09-03;1;http://bubumotos.com/data/producto/grande/1409758744_harrison_wp.jpg,http://bubumotos.com/data/producto/grande/1416818573_axo_harrison.jpg,http://bubumotos.com/data/producto/grande/1409758749_harrison_wp_back.jpg;1;;0;;0;0;0;0;1;0;0;0
2027;1;"CINCHAS HEBILLAS DART/DRONE BUCKEL KIT";42;17.355372;1;;0;NULL;NULL;;;;;;34;;;;;;;;0;1;;;;;;"<p><strong>CINCHAS HEBILLAS DART/DRONE BUCKEL KIT</strong></p>
<p>El Buckel kit incluye 4 hebillas, 4 correas, 4 cierres y tornillos.</p>";cross,trial,casual,;"CINCHAS HEBILLAS DART/DRONE BUCKEL KIT";;;accesorio-axo-cinchas-hebillas-dart-drone-buckel-kit;"En stock";"Bajo pedido";1;2014-09-03;2014-09-03;1;http://bubumotos.com/data/producto/grande/1409759174_buckle_kit_dart_drone.jpg;1;;0;;0;0;0;0;1;0;0;0
2029;1;"HX AIRZONE SOBW ";7,36;73.553719;1;;1;15.45;17.359551;;;;;;23;;;;;;;;0;1;;;;;;"<p><strong>AIRZONE SOBW</strong></p>
<p>Casco tipo Jet de Trial o para su uso en ciudad con calota externa de resina termopl&aacute;stica. Lleva ventilaci&oacute;n frontal y lateral. El relleno protector es de multi-densidad y cierre r&aacute;pido. Visera ajustable. Homologaci&oacute;n Europea ECE/ONU R22.05 &nbsp;</p>";ciudad,;"HX AIRZONE SOBW ";;;casco-jet-helix-hx-airzone-sobw;"En stock";"Bajo pedido";1;2014-09-04;2014-09-04;1;http://bubumotos.com/data/producto/grande/1409843016_airzone_sobw.jpg;1;;0;;0;0;0;0;1;0;0;0
